{
  "id": "ADR-015",
  "fecha": "2026-07-20",
  "titulo": "Trial expiration: fix cron, middleware y env var consistency",
  "estado": "aceptada",
  "contexto": "El sistema de bloqueo por vencimiento de trial no funcionaba. Tres bugs combinados: (1) RegisterUserUseCase hardcodeaba 15 dias de trial en vez de leer TRIAL_PERIOD_DAYS, (2) el cron de expiracion no cubria el estado 'trial' en sus queries, (3) el middleware solo bloqueaba en estado 'bloqueada'. Resultado: usuarios con trial vencido tenian acceso indefinido.",
  "decision": "Corregir los tres puntos de fallo: (1) RegisterUserUseCase ahora lee TRI_PERIOD_DAYS con default 3, (2) list_expiring_soon y list_expired ahora incluyen estado 'trial', (3) el middleware bloquea tanto 'bloqueada' como 'vencida'. El cron transiciona trial→vencida→bloqueada con grace period de 3 dias.",
  "consecuencias": [
    "Positivas: trial vence correctamente, usuarios no tienen acceso indefinido",
    "Positivas: TRIAL_PERIOD_DAYS es la unica fuente de verdad para la duracion del trial",
    "Negativas: usuarios existentes con trial vencido seran bloqueados despues del deploy",
    "Negativas: el valor hardcoded de 15 dias puede haber sido intencional (no hay evidencia)"
  ],
  "alternativas": [
    "Solo corregir el cron sin tocar el middleware (dejar que el cron bloquee)",
    "Agregar un nuevo campo trial_duration_days a la tabla subscriptions para duracion por tenant"
  ],
  "actores": ["@desarrollador", "@opencode"]
}
